{
  "projectId": "PR-02273",
  "mode": "released",
  "branch": "feature/PR-02273",
  "headSha": "7eab66273524",
  "pullRequestUrl": "",
  "evidence": [
    "evidence/release/2026-09-12/README.md"
  ],
  "note": "负责人于 2026-09-12 确认已上线；feature HEAD 已由 merge-base 核验进入 origin/online。项目已归档，不将历史 G4/G6-partial 伪造为 G8 Gate PASS。"
}
