{
  "projectId": "PR-02074",
  "mode": "pushed",
  "branch": "feature/PR-02074",
  "headSha": "839f3a8e44baf924379915e723e0297ef9406772",
  "pullRequestUrl": "",
  "evidence": [
    "origin/feature/PR-02074 @ 839f3a8e44baf924379915e723e0297ef9406772",
    "evidence/gate/2026-09-02-062401-g7/README.md"
  ],
  "note": "Prediction web-next 迁移分支已推送；本地 G7 已通过。G8 通过仅表示开发完成、可提交 test/AQ，不代表 test、pre 或 online 已通过。"
}
